[
  {
    "name": "voertuigregistratie-im",
    "type": "impl",
    "eap": "OSLO-Voertuigregistratie-MAGDA-IMPL.eap",
    "diagram": "OSLO-Voertuigregistratie-MAGDA-IM-Enumeraties",
    "template": "voertuigregistratie-im-impl.j2",
    "title": "Implementatiemodel MAGDA-Voertuigregistratie",
    "publication-state": "https://data.vlaanderen.be/id/concept/StandaardStatus/ZonderStatus",
    "publication-date": "2026-09-14",
    "license": "https://data.vlaanderen.be/id/licentie/modellicentie-gratis-hergebruik/v1.0",
    "contributors-file": "stakeholders.csv",
    "contributors-column": "Rol",
    "site": "site-skeleton/OSLO-Voertuigregistratie-MAGDA-IMPL",
    "feedbackurl": "https://github.com/Informatievlaanderen/OSLOthema-trajectcontrole/issues",
    "standaardregisterurl": "https://data.vlaanderen.be/standaarden/implementatiemodel-magda-voertuigregistraties"
  }
]
