[
  {
    "name": "voertuigregistratie",
    "type": "voc",
    "eap": "OSLO-Voertuigregistratie-MAGDA-IMPL.eap",
    "diagram": "OSLO-Voertuigregistratie",
    "template": "voertuigregistratie-voc.j2",
    "title": "Vocabularium Voertuigregistratie",
    "publication-state": "https://data.vlaanderen.be/id/concept/StandaardStatus/OntwerpStandaard",
    "publication-date": "2026-07-31",
    "license": "https://data.vlaanderen.be/id/licentie/modellicentie-gratis-hergebruik/v1.0",
    "contributors-file": "stakeholders.csv",
    "contributors-column": "Rol",
    "site": "site-skeleton/OSLO-Voertuigregistratie",
    "feedbackurl": "https://github.com/Informatievlaanderen/OSLOthema-trajectcontrole/issues",
    "standaardregisterurl": "https://data.vlaanderen.be/standaarden/vocabularium-voertuigregistratie/"
  }
]
